"Status","Start Time","Stop Time","Duration in ms","Parent Suite","Suite","Sub Suite","Test Class","Test Method","Name","Description"
"passed","Fri Jul 04 09:22:16 GMT 2025","Fri Jul 04 09:22:17 GMT 2025","1277","LMS system","Authentication","Authorization","","","User login with wrong email or password",""
"passed","Fri Jul 04 09:22:19 GMT 2025","Fri Jul 04 09:22:21 GMT 2025","1662","LMS system","Authentication","Registration","","","Registration with correct email, username and password",""
"passed","Fri Jul 04 09:22:14 GMT 2025","Fri Jul 04 09:22:19 GMT 2025","4819","LMS system","Authentication","Authorization","","","User login with correct email and password",""
"passed","Fri Jul 04 09:22:24 GMT 2025","Fri Jul 04 09:22:26 GMT 2025","1915","LMS system","Dashboard","Dashboard","","","Check displaying of dashboard page",""
"passed","Fri Jul 04 09:22:14 GMT 2025","Fri Jul 04 09:22:16 GMT 2025","1853","LMS system","Authentication","Authorization","","","User login with wrong email or password",""
"passed","Fri Jul 04 09:22:19 GMT 2025","Fri Jul 04 09:22:20 GMT 2025","1376","LMS system","Authentication","Authorization","","","User login with wrong email or password",""
"passed","Fri Jul 04 09:22:23 GMT 2025","Fri Jul 04 09:22:26 GMT 2025","3342","LMS system","Courses","Courses","","","Create course",""
"passed","Fri Jul 04 09:22:22 GMT 2025","Fri Jul 04 09:22:24 GMT 2025","1412","LMS system","Courses","Courses","","","Check displaying of empty courses list",""
"passed","Fri Jul 04 09:22:18 GMT 2025","Fri Jul 04 09:22:19 GMT 2025","1444","LMS system","Authentication","Authorization","","","Navigation from login page to registration page",""
