"Status","Start Time","Stop Time","Duration in ms","Parent Suite","Suite","Sub Suite","Test Class","Test Method","Name","Description"
"passed","Wed Jul 09 15:31:37 GMT 2025","Wed Jul 09 15:31:39 GMT 2025","1732","LMS system","Authentication","Registration","","","Registration with correct email, username and password",""
"passed","Wed Jul 09 15:31:32 GMT 2025","Wed Jul 09 15:31:37 GMT 2025","4839","LMS system","Authentication","Authorization","","","User login with correct email and password",""
"passed","Wed Jul 09 15:31:34 GMT 2025","Wed Jul 09 15:31:35 GMT 2025","1315","LMS system","Authentication","Authorization","","","User login with wrong email or password",""
"passed","Wed Jul 09 15:31:32 GMT 2025","Wed Jul 09 15:31:34 GMT 2025","1928","LMS system","Authentication","Authorization","","","User login with wrong email or password",""
"passed","Wed Jul 09 15:31:41 GMT 2025","Wed Jul 09 15:31:42 GMT 2025","1409","LMS system","Courses","Courses","","","Check displaying of empty courses list",""
"passed","Wed Jul 09 15:31:42 GMT 2025","Wed Jul 09 15:31:44 GMT 2025","1938","LMS system","Dashboard","Dashboard","","","Check displaying of dashboard page",""
"passed","Wed Jul 09 15:31:41 GMT 2025","Wed Jul 09 15:31:44 GMT 2025","3609","LMS system","Courses","Courses","","","Create course",""
"passed","Wed Jul 09 15:31:36 GMT 2025","Wed Jul 09 15:31:37 GMT 2025","1367","LMS system","Authentication","Authorization","","","Navigation from login page to registration page",""
"passed","Wed Jul 09 15:31:37 GMT 2025","Wed Jul 09 15:31:39 GMT 2025","1848","LMS system","Authentication","Authorization","","","User login with wrong email or password",""
